{
  "story": {
    "id": "fragments_v2",
    "title": "Fragments",
    "subtitle": "Tu d√≠a, tus decisiones",
    "description": "Una experiencia narrativa que simula un d√≠a completo en tu vida. Cada decisi√≥n afecta tu energ√≠a, √°nimo y nivel de caos.",
    "version": "2.0.0",
    "author": "Yerlinson",
    "max_days": 3,
    "starting_time": "morning",
    "starting_day": 1
  },
  
  "stats": {
    "energia": {
      "name": "Energ√≠a",
      "icon": "‚ö°",
      "min": -15,
      "max": 15,
      "start": 0,
      "color": "#10b981",
      "description": "Tu vitalidad f√≠sica y mental"
    },
    "animo": {
      "name": "√Ånimo",
      "icon": "üíô",
      "min": -15,
      "max": 15,
      "start": 0,
      "color": "#3b82f6",
      "description": "Tu estado emocional y bienestar"
    },
    "caos": {
      "name": "Caos",
      "icon": "üåÄ",
      "min": -15,
      "max": 15,
      "start": 0,
      "color": "#ef4444",
      "description": "El nivel de desorden en tu vida"
    }
  },
  
  "flags": {
    "tutorial_completed": false,
    "has_dog": false,
    "woke_up_early_count": 0,
    "coffee_addiction": 0,
    "helped_colleague_count": 0,
    "ignored_ex": false,
    "adopted_street_dog": false,
    "broke_up": false,
    "got_promotion": false,
    "called_mom_back": false,
    "work_performance": "good",
    "relationship_status": "single",
    "new_job_offer": "none"
  },
  
  "characters": {
    "madre": {
      "name": "Tu Madre",
      "relationship": 50,
      "met": true,
      "description": "Tu madre, siempre preocupada por ti"
    },
    "pablo": {
      "name": "Pablo (Compa√±ero)",
      "relationship": 30,
      "met": false,
      "description": "Tu compa√±ero de trabajo que siempre pide ayuda"
    },
    "ex": {
      "name": "Tu Ex",
      "relationship": 0,
      "met": false,
      "description": "Tu ex pareja. La historia a√∫n no est√° cerrada."
    },
    "jefe": {
      "name": "Tu Jefe",
      "relationship": 50,
      "met": true,
      "description": "Tu superior en el trabajo"
    }
  },
  
  "inventory": {
    "enabled": true,
    "items": [],
    "money": 100,
    "max_items": 10
  },
  
  "settings": {
    "allow_save": true,
    "allow_restart": true,
    "show_stats": true,
    "show_flags": false,
    "show_characters": true,
    "show_inventory": true,
    "enable_sound": true,
    "auto_save": true,
    "save_slots": 3,
    "enable_achievements": true
  },
  
  "achievements": {
    "first_day_complete": {
      "name": "Primer D√≠a Completado",
      "description": "Completa tu primer d√≠a",
      "icon": "üèÜ",
      "unlocked": false
    },
    "dog_lover": {
      "name": "Amante de los Perros",
      "description": "Adopta al perro callejero",
      "icon": "üêï",
      "unlocked": false
    },
    "workaholic": {
      "name": "Adicto al Trabajo",
      "description": "Haz horas extra 3 veces",
      "icon": "üíº",
      "unlocked": false
    },
    "social_butterfly": {
      "name": "Mariposa Social",
      "description": "Mejora tus relaciones con 3 personajes",
      "icon": "ü¶ã",
      "unlocked": false
    }
  }
}
